{
  "schema_version": "1.3.0",
  "definition_id": "loop-engineering-layered-v1",
  "status": "reviewed",
  "initial_state": "inactive",
  "terminal_states": [
    "release_authorized",
    "aborted"
  ],
  "states": {
    "inactive": {
      "stage": "S0",
      "category": "control",
      "description": "No Loop runtime is active.",
      "phase_machine": null,
      "entry_condition": "No active runtime exists.",
      "exit_condition": "A valid req bind operation binds one human-locked REQ."
    },
    "planning": {
      "stage": "S2/S3/S4",
      "category": "work",
      "description": "PM/Architect produces or revises the formal planning phases design, contracts and tasks. The phase cursor is authoritative; artifact inspection is reserved for explicit legacy reconciliation.",
      "phase_machine": "planning",
      "entry_condition": "The locked baseline is captured (TR-001) or specification rework is required (TR-004/013/023).",
      "exit_condition": "At least one CONTRACTS-*.md has status=locked AND at least one TASK-*.md has status=complete (TR-002)."
    },
    "document_verification": {
      "stage": "S5",
      "category": "review",
      "description": "Independent Document Verifiers inspect reviewed contracts and candidate tasks together.",
      "phase_machine": null,
      "entry_condition": "Planning output is complete and internally reviewed.",
      "exit_condition": "Documents pass, require rework, or require a human REQ change."
    },
    "building": {
      "stage": "S6",
      "category": "work",
      "description": "Builders read back, activate and implement the atomically locked contract/task batch.",
      "phase_machine": null,
      "entry_condition": "DOCUMENT_PASS locks exact contract and task versions.",
      "exit_condition": "Builder reports are complete or specification rework is required."
    },
    "verification": {
      "stage": "S7",
      "category": "review",
      "description": "Delivery Verifier, QA, and E2E Browser teams run a complete review round; findings are investigated before repair.",
      "phase_machine": "verification",
      "entry_condition": "Builder or repair output is ready for a full review round.",
      "exit_condition": "A valid clean round passes, a finding enters BUG resolution, or the Loop pauses."
    },
    "bug_resolution": {
      "stage": "S8/S9",
      "category": "work",
      "description": "Findings are investigated, accepted as canonical BUGs, repaired and rechecked by the original finding responsibility.",
      "phase_machine": "bug_resolution",
      "entry_condition": "A blocking Delivery Verifier, QA, or E2E Browser finding exists.",
      "exit_condition": "Targeted re-verification passes and affected evidence is invalidated, or specification/REQ change is required."
    },
    "acceptance": {
      "stage": "S10",
      "category": "work",
      "description": "ACC is assembled from the locked baseline and one valid clean round.",
      "phase_machine": null,
      "entry_condition": "All required same-round evidence passes and no blocking BUG remains.",
      "exit_condition": "ACC is complete or evidence requires another full review."
    },
    "release_audit": {
      "stage": "S10",
      "category": "review",
      "description": "Release architecture, migration, rollback and operational readiness are audited.",
      "phase_machine": null,
      "entry_condition": "ACC is complete and current.",
      "exit_condition": "Audit is approved or blocking findings pause the Loop."
    },
    "paused": {
      "stage": "cross-stage",
      "category": "wait",
      "description": "Automation is suspended with an exact state, phase and entity checkpoint.",
      "phase_machine": null,
      "entry_condition": "Human decision, REQ change, high-risk action, repair limit or runtime integrity requires a pause.",
      "exit_condition": "Human action resumes the checkpoint, reinitializes a changed baseline, or aborts the Loop."
    },
    "awaiting_human_release": {
      "stage": "S11",
      "category": "control",
      "description": "Automation stops at the human release gateway; only constrained human decision events may route S11.",
      "phase_machine": null,
      "entry_condition": "ACC and release architecture audit are approved.",
      "exit_condition": "A human-authorized decision event routes to release_authorized, paused, bug_resolution, acceptance, release_audit, or aborted."
    },
    "release_authorized": {
      "stage": "S11",
      "category": "terminal",
      "description": "An external human release owner authorized the release handoff; the Harness performs no release side effect.",
      "phase_machine": null,
      "entry_condition": "TR-025 records a current human release decision.",
      "exit_condition": "No exit exists."
    },
    "aborted": {
      "stage": "cross-stage",
      "category": "terminal",
      "description": "A human terminated the Loop without release.",
      "phase_machine": null,
      "entry_condition": "Human abort approval is recorded.",
      "exit_condition": "No exit exists."
    }
  },
  "phase_machines": {
    "planning": {
      "owner_state": "planning",
      "initial_phase": "design",
      "entry_phases": [
        "design"
      ],
      "terminal_phases": [
        "tasks"
      ],
      "phases": {
        "design": {
          "description": "Design phase. The Architect completes the architecture package and any required UI design package for the bound REQ.",
          "entry_condition": "TR-001 binds a locked REQ, or a rework transition returns the Loop from DV / building / bug_resolution / paused.",
          "exit_condition": "GATE-PLANNING-DESIGN-COMPLETE is satisfied and PTR-PLAN-01 is committed."
        },
        "contracts": {
          "description": "Contracts phase. The Contractor publishes the locked BE/SYNC/FE contract set with complete REQ and architecture traceability.",
          "entry_condition": "PTR-PLAN-01 commits planning.design -> planning.contracts.",
          "exit_condition": "GATE-PLANNING-CONTRACTS-COMPLETE is satisfied and PTR-PLAN-02 is committed."
        },
        "tasks": {
          "description": "Tasks phase. The Task Planner publishes a complete executable TASK batch and dependency DAG.",
          "entry_condition": "PTR-PLAN-02 commits planning.contracts -> planning.tasks.",
          "exit_condition": "GATE-PLANNING-TASKS-COMPLETE is satisfied and TR-002 moves the Loop to document_verification."
        }
      },
      "transitions": [
        {
          "id": "PTR-PLAN-01",
          "from": "design",
          "selector": "SEL-PLANNING-OUTCOME",
          "automation": {
            "eligible": true,
            "human_boundary": false
          },
          "event": "planning_design_complete",
          "to": "contracts",
          "actors": [
            "orchestrator",
            "hook_controller"
          ],
          "guards": [
            "ui_impact_resolved"
          ],
          "actions": [],
          "required_evidence": [],
          "on_guard_failure": "warn_and_retry",
          "auto_trigger": {
            "enabled": true,
            "event": "PreToolUse",
            "actor": "hook_controller",
            "quality_gate_id": "GATE-PLANNING-DESIGN-COMPLETE",
            "max_per_event": 1,
            "human_required": false
          },
          "description": "Advance formal planning from design to contracts after the design quality gate passes."
        },
        {
          "id": "PTR-PLAN-02",
          "from": "contracts",
          "selector": "SEL-PLANNING-OUTCOME",
          "automation": {
            "eligible": true,
            "human_boundary": false
          },
          "event": "planning_contracts_complete",
          "to": "tasks",
          "actors": [
            "orchestrator",
            "hook_controller"
          ],
          "guards": [],
          "actions": [],
          "required_evidence": [],
          "on_guard_failure": "warn_and_retry",
          "auto_trigger": {
            "enabled": true,
            "event": "PreToolUse",
            "actor": "hook_controller",
            "quality_gate_id": "GATE-PLANNING-CONTRACTS-COMPLETE",
            "max_per_event": 1,
            "human_required": false
          },
          "description": "Advance formal planning from contracts to tasks after the contract quality gate passes."
        }
      ]
    },
    "verification": {
      "owner_state": "verification",
      "initial_phase": "delivery",
      "entry_phases": [
        "delivery"
      ],
      "terminal_phases": [
        "clean_round_passed"
      ],
      "phases": {
        "delivery": {
          "description": "Run every required Delivery Verifier responsibility for the current round.",
          "entry_condition": "A complete team manifest and Builder/repair evidence exist.",
          "exit_condition": "All dimensions pass or findings leave the top-level state."
        },
        "qa": {
          "description": "Run every required QA responsibility for the same review round.",
          "entry_condition": "All Delivery Verifier dimensions pass.",
          "exit_condition": "All QA dimensions pass or findings leave the top-level state."
        },
        "e2e_browser": {
          "description": "Run real-browser E2E user flows for the same review round.",
          "entry_condition": "Delivery Verifier and QA dimensions pass.",
          "exit_condition": "All required E2E browser responsibilities pass or findings leave the top-level state."
        },
        "clean_round_evaluation": {
          "description": "Validate same-round completeness, evidence freshness and closed blocking BUGs.",
          "entry_condition": "Delivery, QA, and E2E Browser all report PASS for one round.",
          "exit_condition": "The round passes or review restarts at delivery."
        },
        "clean_round_passed": {